Name,Price,Category
Carrefour Eski Kaşar Peynir,"49,90 TL",Dil Peyniri
Carrefour Eski Kaşar 500 g,"23,50 TL",Dil Peyniri
Tahsildaroğlu İzmir Tulum 350 g,"29,90 TL",Eski Kaşar
Gazi Hellim Peyniri 250 g,"11,90 TL",Eski Kaşar
Ekici Hellim Peyniri 250 g,"14,50 TL",Tulum Peyniri
Cihanser Hellim Peyniri 1  kg,"45,90 TL",Tulum Peyniri
Pınar Keyif Hellim Peyniri 250 g,"15,95 TL",Hellim Peyniri
Tahsildaroğlu Çeçil Peyniri 250 g,"14,45 TL",Hellim Peyniri
Muratbey Topi Peynir 200 g,"9,55 TL",Hellim Peyniri
Ekici Çeçil (Tel) Peynir 250 g,"14,95 TL",Hellim Peyniri
Muratbey Lor Peyniri 500 g,"6,95 TL",Hellim Peyniri
Ekici Top Peynirim 200 g,"9,95 TL",Hellim Peyniri
Tahsildaroğlu Kahvaltılık Lor 300 g,"8,90 TL",Hellim Peyniri
Tahsildaroğlu Torba Lor Peynir 500 g,"8,45 TL",Hellim Peyniri
Muratbey Tel Peyniri 200 g,"10,15 TL",Diğer
Muratbey Burgu Peyniri 200 g,"9,55 TL",Diğer
Sütaş Mihaliç Peynir 350 g,"31,90 TL",Diğer
Tahsildaroğlu Süt Damlası 200G,"12,95 TL",Diğer
Gazi Lor Peyniri 500 g,"9,50 TL",Diğer
Tahsildaroğlu Dil Peyniri 250 g,"14,45 TL",Diğer
Cihanser Eski Kaşar  kg,"56,90 TL",Diğer
Sütaş Dil Peyniri 250 g,"16,95 TL",Diğer
Cihanser Kars Gravyeri kg,"119,90 TL",Diğer
Ünal Lüx Trakya Kaşar Peyniri,"99,90 TL",Diğer
Cıhanser Kars Eski Kaşar,"69,90 TL",Dil Peyniri
Tahsildaroğlu Ezine Eski Kaşar kg,"79,90 TL",Dil Peyniri
Pınar Atıştırmalık Dil Peyniri 20 g,"2,00 TL",Dil Peyniri
Ekici Tel Peynir,"46,90 TL",Dil Peyniri
Tahsildaroğlu Örgü Peyniri 250 g,"14,45 TL",Dil Peyniri
Ünal Kahvaltılık Lor Peyniri,"23,90 TL",Dil Peyniri
Cihan Ser Hellim Peyniri,"59,90 TL",Açık Yöresel Peynir
Sütaş Örgü Peyniri 250 g,"19,95 TL",Açk Yöresel Peynir
Mersoy Erzincan Tulum Peyniri kg,"56,90 TL",Açık Yöresel Peynir
Ünal Örgü Peyniri,"59,90 TL",Açk Yöresel Peynir
"Ekici Klasik Beyaz Peynir, kg","47,90 TL",Açık Yöresel Peynir
Letafet Çerkez Peyniri,"36,90 TL",Açk Yöresel Peynir
Ak-Du Klasik İnek Peyniri,"34,90 TL",Açık Yöresel Peynir
Ünal Çeçil Peyniri kg,"59,90 TL",Açk Yöresel Peynir
Ünal Dil Peyniri kg,"59,90 TL",Açık Yöresel Peynir
Tahsildaroğlu Dil Peyniri kg,"64,90 TL",Açk Yöresel Peynir
Tahsildaroğlu Ezine Klasik Peynir kg,"48,90 TL",Açık Yöresel Peynir
Frico Gouda Kimyonlu 220 g,"53,90 TL",Açk Yöresel Peynir
Frico Keçi Gouda 220 g,"76,90 TL",Açık Yöresel Peynir
Blue Heaven Danish 225 g,"43,90 TL",Açk Yöresel Peynir
Frico Sade Gouda 220 g,"49,45 TL",Açık Yöresel Peynir
Blue Heavendanish Blue Cheese 100 g,"26,50 TL",Açk Yöresel Peynir
Frico Maasdam Peyniri 260 g,"40,25 TL",Açık Yöresel Peynir
Frico Gouda Light Peynir 235 g,"43,75 TL",Açk Yöresel Peynir
Bahçıvan Suda Top Mozzarella 125 g,"10,95 TL","Rokfor, Camembert ve Brie"
Frico Eski Gouda,"57,50 TL",Rokfor Camembert ve Brie
Frico Füme Peynir Biberli 220 g,"39,75 TL","Rokfor, Camembert ve Brie"
Frico Mimolette 235 g,"47,90 TL",Rokfor Camembert ve Brie
Castello Rokfor 100 g,"32,75 TL","Rokfor, Camembert ve Brie"
Bahçıvan Parmesan 200 g,"61,75 TL",Rokfor Camembert ve Brie
Bahçıvan Rende Mozzarella Peyniri 150 g,"12,45 TL","Rokfor, Camembert ve Brie"
Frico Edam Peyniri 235 g,"35,90 TL",Rokfor Camembert ve Brie
Frico Westland Otlu Gouda Peyniri 220 g,"41,50 TL","Rokfor, Camembert ve Brie"
Glovanni Colombo Mascarpone 250 g,"38,95 TL",Rokfor Camembert ve Brie
Rani Parmesan Peyniri Kg,"187,90 TL","Rokfor, Camembert ve Brie"
Rani Çiftliği Cheddar Blok,"92,90 TL",Rokfor Camembert ve Brie
Sütaş Kaşar Peyniri 700 g,"24,95 TL","Rokfor, Camembert ve Brie"
Ekici Taze Kaşar 400 g,"18,95 TL",Rokfor Camembert ve Brie
Muratbey Taze Kaşar 600 g,"19,90 TL","Rokfor, Camembert ve Brie"
Sütaş Kaşar Peyniri 400 g,"16,95 TL",Rokfor Camembert ve Brie
İçim Kaşar Peyniri 600 g,"20,95 TL","Rokfor, Camembert ve Brie"
İçim Kaşar Peyniri 400 g,"17,45 TL",Rokfor Camembert ve Brie
Sek Kaşar Peyniri 400 g,"15,95 TL",Açık İthal Peynirler
Gazi Tost Peyniri 400 g,"15,90 TL",Açk İthal Peynirler
Gazi Tost Peyniri 700 g,"26,90 TL",Açık İthal Peynirler
Torku Tost Peyniri 650 g,"19,95 TL",Açk İthal Peynirler
Pınar Kahvaltı Keyfi Tost Peyniri 700G,"35,75 TL",Açık İthal Peynirler
Torku Taze Kaşar Peynir 400 g,"19,95 TL",Açk İthal Peynirler
Tahsildaroğlu Kaşar 400 g,"23,50 TL",Taze Kaşar
İçim Kaşar Peyniri 1 kg,"37,90 TL",Taze Kaşar
Pınar Taze Kaşar Kahvaltı Keyfi 400 g,"21,95 TL",Taze Kaşar
Tarım Kredi Tost Peyniri Kuru 700 g,"26,50 TL",Taze Kaşar
Tarım Kredi Kaşar Peyniri 700 g,"29,50 TL",Taze Kaşar
Tarım Kredi Kaşar Peyniri 400 g,"16,90 TL",Taze Kaşar
Ekici Pratik Kaşar Peyniri 20 g,"1,75 TL",Taze Kaşar
Tahsildaroğlu Kaşar Peyniri 600 g,"33,90 TL",Taze Kaşar
Sütaş Kaşar Peyniri 225 g,"12,95 TL",Taze Kaşar
Pınar Atıştırmalık Taze Kaşar Peyniri 20 g,"2,00 TL",Taze Kaşar
Baltalı Keçi Kaşar Peyniri 300 g,"31,90 TL",Taze Kaşar
Tahsildaroğlu Ezine Eski Kaşar 350 g,"30,95 TL",Taze Kaşar
Cihan-Ser Eski Kaşar Peynir 100 g,"7,90 TL",Taze Kaşar
Cihanser Kars Eski Kaşar 350 g,"22,90 TL",Taze Kaşar
Sütaş Eski Kaşar Peyniri 350 g,"43,90 TL",Taze Kaşar
Pınar Tost Dilimli Peynir 500 Gr,"19,95 TL",Taze Kaşar
Pınar Dilimli Tost Peyniri 350 g,"17,25 TL",Taze Kaşar
İçim Dilimli Tost Peyniri 200 g,"9,95 TL",Taze Kaşar
İçim Dilimli Tost Peyniri 500 g,"24,45 TL",Taze Kaşar
Sütaş Dilimli Kaşar Peyniri 60 g,"4,95 TL",Taze Kaşar
Pınar Tost Dilimli Peynir 200 g,"12,95 TL",Taze Kaşar
Torku Dilimli Tost Peynir 700 g,"37,50 TL",Taze Kaşar
Torku Dilimli Tost Peynir 350 g,"20,90 TL",Eski Kaşar
Sütaş Sandviç Peyniri 110 g,"9,45 TL",Eski Kaşar
Sütaş Tost Peyniri 110 g,"9,45 TL",Dilimli Taze Kaşar
Gazi Tost Peyniri kg,"36,90 TL",Dilimli Taze Kaşar
Torku Tost Peynir 2 kg,"45,90 TL",Açık Kaşar
"Ekici Taze Kaşar Peyniri, kg","47,90 TL",Açk Kaşar
Lüks Anadolu Kaşar Peyniri kg,"69,90 TL",Açık Kaşar
Ünal Blok Taze Kaşar Peyniri kg,"49,90 TL",Açk Kaşar
Sütaş Pratik Tam Yağlı Beyaz Peynir 1 kg,"27,50 TL",Açık Kaşar
Muratbey Taze Peynir Sürmeli 700 g,"16,95 TL",Açk Kaşar
Ekici Beyaz Peynir Plastik Kap 500 g,"14,95 TL",Açık Kaşar
Sütaş Tam Yağlı Beyaz Peynir 500 g,"13,95 TL",Açk Kaşar
Sütaş Light Beyaz Peynir 700 g,"18,95 TL",Açık Kaşar
Sek Tam Yağlı Beyaz Peynir 800 g,"18,95 TL",Açk Kaşar
Pınar Beyaz Peynir 400 g,"20,95 TL",Yarım Yağlı Beyaz Peynir (İnek)
Pınar Kahvaltı Keyfi Beyaz Peynir 800 g,"29,95 TL",Yarm Yağl Beyaz Peynir İnek
Tahsildaroğlu Beyaz Peynir 800 g,"26,90 TL",Yarım Yağlı Beyaz Peynir (İnek)
İçim Kutu Beyaz Peynir 500 g,"10,95 TL",Yarm Yağl Beyaz Peynir İnek
Torku Beyaz Peynir 1 kg,"26,45 TL",Yarım Yağlı Beyaz Peynir (İnek)
Torku Beyaz Peynir 500 g,"14,95 TL",Yarm Yağl Beyaz Peynir İnek
Pınar Light Beyaz Peynir 400 g,"22,20 TL",Yarım Yağlı Beyaz Peynir (İnek)
Pınar Salamuralı Beyaz Peynir 800 g,"34,90 TL",Yarm Yağl Beyaz Peynir İnek
Pınar Beyaz Peynir Salamura Kahvaltı Keyfi 400 g,"16,75 TL",Yarım Yağlı Beyaz Peynir (İnek)
İçim Beyaz Peynir 900 g,"19,50 TL",Yarm Yağl Beyaz Peynir İnek
Sütaş Beyaz Peynir 250 g,"9,95 TL",Yarım Yağlı Beyaz Peynir (İnek)
Ekici Tam Yağlı Peynir 1000 g,"29,50 TL",Yarm Yağl Beyaz Peynir İnek
Ekici Klasik Peynir 600 g,"28,95 TL",Tam Yağlı Beyaz Peynir (İnek)
Sütaş Klasik Beyaz Peynir 600 g,"33,95 TL",Tam Yağl Beyaz Peynir İnek
Tahsildaroğlu Klasik Peynir 525 g,"35,45 TL",Tam Yağlı Beyaz Peynir (İnek)
Tahsildaroğlu Lüx Klasik Beyaz Peynir 600 g,"35,45 TL",Tam Yağl Beyaz Peynir İnek
Tarım Kredi Klasik Beyaz  Peynir 600 g,"26,90 TL",Tam Yağlı Beyaz Peynir (İnek)
Altınkılıç Ezine Klasik Peynir 500 g,"27,45 TL",Tam Yağl Beyaz Peynir İnek
Pınar Süzme Peynir 100 g,"4,50 TL",Tam Yağlı Beyaz Peynir (İnek)
Sütaş Süzme Peynir 1 kg,"24,95 TL",Tam Yağl Beyaz Peynir İnek
Ekici Süzme Peynir 500 g,"13,45 TL",Tam Yağlı Beyaz Peynir (İnek)
Sütaş Süzme Peynir 500 g,"13,45 TL",Tam Yağl Beyaz Peynir İnek
Sütaş Süzme Form Peynir 500 g,"12,95 TL",Tam Yağlı Beyaz Peynir (İnek)
Torku Süzme Peynir 450 g,"10,45 TL",Tam Yağl Beyaz Peynir İnek
Torku Süzme Peynir 850 g,"19,45 TL",Süzme Peynir
Sütaş Süzme Peynir 250 g,"7,45 TL",Süzme Peynir
Pınar Süzme Peynir 500 g,"12,25 TL",Süzme Peynir
Sütaş Süzme Porsiyon Peynir 4x25 g,"5,95 TL",Süzme Peynir
Pınar Süzme Peynir Az Tuzlu Az Yağlı 500 g,"12,45 TL",Süzme Peynir
Pınar Süzme Peynir 250 g,"7,45 TL",Süzme Peynir
İçim Süzme Beyaz Peynir 500 g,"12,75 TL",Süzme Peynir
"Muratbey Burgu Peyniri kg, kg","39,90 TL",Süzme Peynir
Sütaş Tam Yağlı Koyun Peyniri 600 g,"44,95 TL",Süzme Peynir
Sütaş Keçi Peyniri 600 g,"44,95 TL",Süzme Peynir
Tahsildaroğlu Ezine Keçi Peyniri kg,"54,90 TL",Süzme Peynir
Tahsildaroğlu Ezine Koyun Peyniri kg,"54,90 TL",Süzme Peynir
Tahsildaroğlu Dilimli Koyun Peyniri 525 g,"42,90 TL",Beyaz Peynir (Koyun)
Ekici Top Peynirim,"56,90 TL",Beyaz Peynir Koyun
Lezzine Gurme Koyun Peyniri 600 g,"49,90 TL",Beyaz Peynir (Koyun)
Baltalı Keçi Peyniri Seferihisar 350 g,"30,45 TL",Beyaz Peynir Koyun
Tahsildaroğlu Dilimli Keçi Peyniri 525 g,"42,90 TL",Beyaz Peynir (Koyun)
Tahsildaroğlu Ezine Keçi Peyniri 600 g,"42,90 TL",Beyaz Peynir Koyun
Ekici Peynir Çubukları ,"56,90 TL",Beyaz Peynir (Koyun)
Ünal Koyun Peyniri,"69,90 TL",Beyaz Peynir Koyun
Lezzine Gurme Keçi Peyniri 600 g,"49,90 TL",Beyaz Peynir (Koyun)
Tahsildaroğlu Ezine Koyun Peyniri 600 g,"42,90 TL",Beyaz Peynir Koyun
Calmio Yarım Yağlı Beyaz Peynir kg,"17,90 TL",Beyaz Peynir (Koyun)
"Ekici Tam Yağlı Beyaz Peynir, kg","29,50 TL",Beyaz Peynir Koyun
İçim Dilimli Burger Peynir 200 g,"13,25 TL",Beyaz Peynir (Koyun)
İçim Labne 200 g,"6,95 TL",Beyaz Peynir Koyun
La Vache Qui Rit Avantaj Paketi 24*300 Gr ,"13,50 TL",Beyaz Peynir (Koyun)
Sütaş Labne 400 g,"13,90 TL",Beyaz Peynir Koyun
İçim Taze Peynir 180 g,"6,95 TL",Beyaz Peynir (Koyun)
İçim Labne 400 g,"10,95 TL",Beyaz Peynir Koyun
İçim Labne Peynir 3x180 g,"15,75 TL",Beyaz Peynir (Koyun)
Gazi Burger Peyniri 250 g,"12,90 TL",Beyaz Peynir Koyun
Ekici Krem Peynir 500 g,"16,45 TL",Açık Beyaz Peynir
İçim Simitle Cheddarlı Krem Peynir 300 g,"9,45 TL",Açk Beyaz Peynir
Pınar Labne Peynir 200 g,"7,20 TL",Açık Beyaz Peynir
Pınar Beyaz Krem Peynir 200 g,"7,95 TL",Açk Beyaz Peynir
Sütaş Labne Peynir 200 g,"7,95 TL",Krem Peynir
La Vache Qui Rit Cheddarlı Dilimli 200 g,"13,95 TL",Krem Peynir
La Vache Qui Rit Sade Dilimli 200 g,"12,95 TL",Krem Peynir
La Vache Quirit Krem Peynir 400g,"16,75 TL",Krem Peynir
La Vache Quirit 8'li Cheddarlı 108 g,"6,75 TL",Krem Peynir
Sek Kekikli ve Zeytinli Taze Peynir 150 g,"6,95 TL",Krem Peynir
Pınar Krem Peynir 300 g,"11,95 TL",Krem Peynir
Pınar Labne 400 g,"13,70 TL",Krem Peynir
Sütaş Dilimli Kaşar Peyniri 150 g 8'li,"9,95 TL",Krem Peynir
Kerrygold Cheddar 200 g,"40,50 TL",Krem Peynir
Sütaş Krem Peynir 300 g,"11,95 TL",Krem Peynir
Pınar Labne 750 g,"22,95 TL",Krem Peynir
Pınar Light Üçgen Peynir 8X12.5 g,"6,90 TL",Krem Peynir
Pınar Labne 3*200 G Avantaj Paket,"19,85 TL",Krem Peynir
Pınar Üçgen Peynir 8*12 g,"5,80 TL",Krem Peynir
Pınar Cheddar Dilimli Peynir 200 g,"18,70 TL",Krem Peynir
Sutaş Krem Peynir 160 g,"8,45 TL",Krem Peynir
Karper 18 Porsiyon 324 g,"15,50 TL",Krem Peynir
Pınar Dilimli Burger Peyniri 350 g,"23,95 TL",Krem Peynir
Pınar Süt Krem 160 g,"8,50 TL",Krem Peynir
Karper Sade 6 Porsiyon 108 g,"5,70 TL",Krem Peynir
La Vache Qui Rit 8 Porsiyon 108G,"6,75 TL",Krem Peynir
La Vache Qui Rit Krem Peynir 160 g,"7,95 TL",Krem Peynir
Pınar Labne 2*400 g,"24,50 TL",Krem Peynir
Pınar Labne 8'li 20 g,"8,45 TL",Krem Peynir
Karper 16 Porsiyon 200 g,"10,45 TL",Krem Peynir
Sütaş Burger Peyniri 110 g,"9,45 TL",Krem Peynir
Sek Sade Taze Peynir 150 g,"6,95 TL",Krem Peynir
Pınar Beyaz 400 g,"15,65 TL",Krem Peynir
La Vache Qui Rit 16 Porsiyon 200g,"11,45 TL",Krem Peynir
Karper 8 Porsiyon 100 g,"5,70 TL",Krem Peynir
Pınar Beyaz 8'li 20 g,"8,50 TL",Krem Peynir
Pınar Atıştırmalık Cheddar 20 g,"2,00 TL",Krem Peynir
Torku Krempare 200 g,"7,95 TL",Krem Peynir
Torku Krempare 450 g,"13,90 TL",Krem Peynir
Baltalı Keçi Labne 200 g,"11,95 TL",Krem Peynir
Lavache Qui Rit Krem Peynir 290G,"12,50 TL",Krem Peynir
